56,2,2,2,2,2,2,2,2,0,0,0,0,0,0,0,0,1,1,1,1,1,1,1,1,0,0,0,0,0,0,0,0,0,0,0,0,0,0,0,0,false,false,false,false,false,false,false,false,0,0,0,6,0,0,0,0,"喂，那位冒险者！<br>你来得正好，我有件事想拜托你！","他们在打架啊！拜托你劝劝架。<br>我想让他们2个淡定点，但毕竟都是海之子，<br>都倔得很，根本不听我的劝。","所以干脆不要客气，直接给他们两拳，<br>让那些笨蛋清醒清醒！","要让他们清醒清醒吗？<br><br><color #FF7B1A>※此危命任务的推荐等级为<value>级。</color>","","","呃……好吧。<br>抱歉让你为难了。",""
57,0,0,0,0,0,0,0,0,0,0,0,0,0,0,0,0,1,1,1,1,1,1,1,1,0,0,0,0,0,0,0,0,0,0,0,0,0,0,0,0,false,false,false,false,false,false,false,false,0,0,0,6,0,0,0,0,"哎？！我、我可没有输啊。<br>这只是……一时大意！","都是因为那个女人说要比实力，<br>我就奉陪了一下。但没想到她竟然那么强！","对了，你也帮我一把吧！<br>打架管什么规则！","要帮忙吗？<br><br><color #FF7B1A>※此危命任务的推荐等级为<value>级。</color>","","","嘁，你不会是害怕吧。",""
58,2,2,2,2,2,2,2,2,0,0,0,0,0,0,0,0,1,1,1,1,1,1,1,1,0,0,0,0,0,0,0,0,0,0,0,0,0,0,0,0,false,false,false,false,false,false,false,false,0,0,0,0,0,0,0,0,"目前我们黑涡团正在进行德内维尔关的防卫训练！<br>目标是歼灭攻过来的黑涡团教导队员！<br>如果你原意，可以允许你参与此次训练！","","","","","","",""
59,2,2,2,2,2,2,2,2,0,0,0,0,0,0,0,0,1,1,1,1,1,1,1,1,0,0,0,0,0,0,0,0,0,0,0,0,0,0,0,0,false,false,false,false,false,false,false,false,0,0,0,0,0,0,0,0,"哦，你是冒险者吗？来得正好！<br>你也来练一练我们那些孱弱的新兵吧，<br>让他们回炉重造一下！","","","","","","",""
60,2,2,2,2,2,2,2,2,0,0,0,0,0,0,0,0,1,1,1,1,1,1,1,1,0,0,0,0,0,0,0,0,0,0,0,0,0,0,0,0,false,false,false,false,false,false,false,false,0,0,0,0,0,0,0,0,"冒险者，快来帮帮我！<br>装香橙的木箱正受到攻击！那是我好不容易才摘下来的！<br>请你把聚集在木箱周围的码头沟鼠消灭掉！","","","","","","",""
61,2,2,2,2,2,2,2,2,0,0,0,0,0,0,0,0,1,1,1,1,1,1,1,1,0,0,0,0,0,0,0,0,0,0,0,0,0,0,0,0,false,false,false,false,false,false,false,false,0,0,0,0,0,0,0,0,"啊啊，这些婴猴真烦人！<br>这样我根本没办法把小麦粉运出去啊……","","","","","","",""
62,2,2,2,2,2,2,2,2,0,0,0,0,0,0,0,0,1,1,1,1,1,1,1,1,0,0,0,0,0,0,0,0,0,0,0,0,0,0,0,0,false,false,false,false,false,false,false,false,0,0,0,0,0,0,0,0,"ヤーゾンめ、ウジャウジャ集まりやがって……。<br>杭打ち機はくれてやるもんか！","","","","","","",""
63,2,2,2,2,2,2,2,2,0,0,0,0,0,0,0,0,1,1,1,1,1,1,1,1,0,0,0,0,0,0,0,0,0,0,0,0,0,0,0,0,false,false,false,false,false,false,false,false,0,0,0,0,0,0,0,0,"要保护好资料，快！<br>快把哥布林族赶走！","","","","","","",""
64,2,2,2,2,2,2,2,2,0,0,0,0,0,0,0,0,1,1,1,1,1,1,1,1,0,0,0,0,0,0,0,0,0,0,0,0,0,0,0,0,false,false,false,false,false,false,false,false,0,0,0,0,0,0,0,0,"啊哇哇哇！<br>鬼鮟鱇聚在一起把浅滩的小鱼吃掉了！<br>那可是我的晚饭！","","","","","","",""
65,2,2,2,2,2,2,2,2,0,0,0,0,0,0,0,0,1,1,1,1,1,1,1,1,0,0,0,0,0,0,0,0,0,0,0,0,0,0,0,0,false,false,false,false,false,false,false,false,0,0,0,0,0,0,0,0,"我的父亲被鬼鮟鱇吃掉了……<br>快去帮我把那些家伙全部消灭掉，为父亲报仇！","","","","","","",""
66,1,1,1,1,1,1,1,1,0,0,0,0,0,0,0,0,1,1,1,1,1,1,1,1,0,0,0,0,0,0,0,0,0,0,0,0,0,0,0,0,false,false,false,false,false,false,false,false,0,0,0,6,0,0,0,0,"嗯，我能从你的身上感受到炙热的斗魂。<br>你是个相当有实力的强者，<br>我想拜托你件事！","我听说那边的蜥蜴人军阵地有一个新指挥官上任。<br>所以就偷偷过来侦查……<br>但是那些家伙竟然已经在做进军准备了！","现在已经来不及等待援军了。<br>所以我希望你能和我一起闯入他们阵地，破坏物资，<br>讨伐他们的新指挥官，阻止他们的进军！","要帮忙吗？<br><br><color #FF7B1A>※此危命任务的推荐等级为<value>级。</color>","","","嗯，你还是怕去送死么！<br>好吧，我只好单枪匹马冲进去了……",""
67,2,2,2,2,2,2,2,2,0,0,0,0,0,0,0,0,1,1,1,1,1,1,1,1,0,0,0,0,0,0,0,0,0,0,0,0,0,0,0,0,false,false,false,false,false,false,false,false,0,0,6,0,0,0,0,0,"既然向我搭话，那是不是意味着你要帮我啊？<br>我正在收集埋藏在这里守卫身体里的魂石。","那是用来进行古代魔法研究的……<br>不过我实在是对付不了那些又大又坚硬的大块头。","要帮忙吗？<br><br><color #FF7B1A>※此危命任务的推荐等级为<value>级。</color>","","好棒，我最喜欢勤劳的人了。","","哎呀，真是个装模作样的人，过分。<br>一点都不懂得怜香惜玉。",""
68,2,2,2,2,2,2,2,2,0,0,0,0,0,0,0,0,1,1,1,1,1,1,1,1,0,0,0,0,0,0,0,0,0,0,0,0,0,0,0,0,false,false,false,false,false,false,false,false,0,0,0,0,0,0,0,0,"我需要巨像兵的魂石。<br>你能为了我去敲碎那些守卫吗？","","","","","","",""
69,2,2,2,2,2,2,2,2,0,0,0,0,0,0,0,0,1,1,1,1,1,1,1,1,0,0,0,0,0,0,0,0,0,0,0,0,0,0,0,0,false,false,false,false,false,false,false,false,0,5,0,0,0,0,0,0,"你得到巨像兵的魂石了吧。<br>我可不喜欢装模作样的人哦。","","","","哼，很好……真是冰冷的心脏……<br>我想要更深入地进行调查，<br>你能再拿来一些吗？","","真讨厌。那些东西只能增加你的负担哦。",""
70,2,2,2,2,2,2,2,2,0,0,0,0,0,0,0,0,1,1,1,1,1,1,1,1,0,0,0,0,0,0,0,0,0,0,0,0,0,0,0,0,false,false,false,false,false,false,false,false,0,0,6,0,0,0,0,0,"请帮帮我，我需要食物。<br>不然妈妈会因为一直连续工作而倒下的！","我要求不高，只要给我仙人掌的肉质茎就好了。<br>我想让妈妈能吃饱一些……","要帮忙吗？<br><br><color #FF7B1A>※此危命任务的推荐等级为<value>级。</color>","","太好了……<br>被仙人掌刺到可是很疼的，你要小心啊。","","不行么……<br>我果然还是要……更努力才行……",""
71,2,2,2,2,2,2,2,2,0,0,0,0,0,0,0,0,1,1,1,1,1,1,1,1,0,0,0,0,0,0,0,0,0,0,0,0,0,0,0,0,false,false,false,false,false,false,false,false,0,0,0,0,0,0,0,0,"我想要仙人掌的肉质茎。<br>我想让妈妈能填饱肚子！","","","","","","",""
72,2,2,2,2,2,2,2,2,0,0,0,0,0,0,0,0,1,1,1,1,1,1,1,1,0,0,0,0,0,0,0,0,0,0,0,0,0,0,0,0,false,false,false,false,false,false,false,false,0,5,0,0,0,0,0,0,"啊，是仙人掌的肉质茎！<br>求求你，请分给我一些！","","","","谢谢你！如果再能有一些就好了……","","也是啊，没有理由分给外人啊……",""
73,2,2,2,2,2,2,2,2,0,0,0,0,0,0,0,0,1,1,1,1,1,1,1,1,0,0,0,0,0,0,0,0,0,0,0,0,0,0,0,0,false,false,false,false,false,false,false,false,0,0,0,6,0,0,0,0,"呀吼，那边的朋友！<br>我是盛夏的舞女伊·米蕾娃。<br>请你听一听米蕾娃的请求。","米蕾娃现在要去隐秘瀑布，<br>给有钱的叔叔带去特别的舞蹈……","但是我自己一个人去心里好害怕。<br>所以想要你陪米蕾娃一起到那个叔叔家里去！","要陪她去吗？<br><br><color #FF7B1A>※此危命任务的推荐等级为<value>级。</color>","","","真是的，你真坏心眼！<br>米蕾娃就这么没有魅力吗？",""
74,1,1,1,1,1,1,1,1,0,0,0,0,0,0,0,0,1,1,1,1,1,1,1,1,0,0,0,0,0,0,0,0,0,0,0,0,0,0,0,0,false,false,false,false,false,false,false,false,4,4,4,4,4,4,4,4,"这座桥总是会受到卢恩人的袭击。<br>因为有很多物资都从这里运输，<br>所以才容易被盯上吧。","啊，我可没想要吓唬你啊。<br>放心吧，到时候还有我们呢。","","","","","",""
75,1,1,1,1,1,1,1,1,0,0,0,0,0,0,0,0,1,1,1,1,1,1,1,1,0,0,0,0,0,0,0,0,0,0,0,0,0,0,0,0,false,false,false,false,false,false,false,false,4,4,4,4,4,4,4,4,"虽然我想要在这里做生意，<br>但这地方有些不太平啊。","虽然挨着飞空艇搭乘点是很有吸引力，<br>可越是这种能赚钱的地方，<br>就越容易聚集不良人员。","毕竟还发生了卢恩人绑走人类之后卖给蜥蜴人族的事件。<br>真是想想就吓人啊……","","","","",""
76,1,1,1,1,1,1,1,1,0,0,0,0,0,0,0,0,1,1,1,1,1,1,1,1,0,0,0,0,0,0,0,0,0,0,0,0,0,0,0,0,false,false,false,false,false,false,false,false,4,4,4,4,4,4,4,4,"干嘛？要买东西到隔壁。<br>我可是很忙的。","我必须要在下一班飞空艇着陆前备好货，<br>不然就亏本了。时间就是金钱啊！","","","","","",""
77,0,0,0,0,0,0,0,0,0,0,0,0,0,0,0,0,1,1,1,1,1,1,1,1,0,0,0,0,0,0,0,0,0,0,0,0,0,0,0,0,false,false,false,false,false,false,false,false,4,4,4,4,4,4,4,4,"队长大人好棒的喵。<br>我们要始终追随队长大人喵。","毕竟脸长得好帅的喵。","","","","","",""
78,1,1,1,1,1,1,1,1,0,0,0,0,0,0,0,0,1,1,1,1,1,1,1,1,0,0,0,0,0,0,0,0,0,0,0,0,0,0,0,0,false,false,false,false,false,false,false,false,4,4,4,4,4,4,4,4,"怎么？你也想加入我的部队吗？","抱歉了，已经没有多余的空位给你了。<br>因为想要入队的姑娘们太多了，呵呵。","不过，在你呆在这里的这段期间，<br>就可以和其他市民及部下一样，得到我的庇护。<br>我可是很重视我的拥护者的。","","","","",""
79,0,0,0,0,0,0,0,0,0,0,0,0,0,0,0,0,1,1,1,1,1,1,1,1,0,0,0,0,0,0,0,0,0,0,0,0,0,0,0,0,false,false,false,false,false,false,false,false,4,4,4,4,4,4,4,4,"哼哼，哼哼哼哼……<br>我有的时候能和队长大人说上话喵。","虽然不太明白在说什么，<br>但是队长大人真的好帅啊！","","","","","",""
80,1,1,1,1,1,1,1,1,0,0,0,0,0,0,0,0,1,1,1,1,1,1,1,1,0,0,0,0,0,0,0,0,0,0,0,0,0,0,0,0,false,false,false,false,false,false,false,false,4,4,4,4,4,4,4,4,"街道的尽头是一望无际的黑衣森林。<br>那里会有新的邂逅在等待着我……","……虽然是这么觉得。<br>不过还是好害怕魔物啊。","","","","","",""
81,1,1,1,1,1,1,1,1,0,0,0,0,0,0,0,0,1,1,1,1,1,1,1,1,0,0,0,0,0,0,0,0,0,0,0,0,0,0,0,0,false,false,false,false,false,false,false,false,4,4,4,4,4,4,4,4,"欢迎来到跨天桥。<br>虽然现在挺安静的，<br>不过到飞空艇起航和着陆的时候相当热闹。","因为之前的灵灾地面产生了一个巨大的裂缝，<br>所以才搭建了这座桥方便两边的往来。<br>希望这里可以凭借遗迹和飞空艇乘降等优势成为萨纳兰的新名胜。","","","","","",""
82,0,0,0,0,0,0,0,0,0,0,0,0,0,0,0,0,1,1,1,1,1,1,1,1,0,0,0,0,0,0,0,0,0,0,0,0,0,0,0,0,false,false,false,false,false,false,false,false,4,4,4,4,4,4,4,4,"嗯，咳咳……你想要搭乘飞空艇吗？<br>不好意思，这个搭乘点不面向个人开放。","如果你有搭乘许可证的话，<br>可以到乌尔达哈飞艇坪的窗口去。","","","","","",""
83,0,0,0,0,0,0,0,0,0,0,0,0,0,0,0,0,1,1,1,1,1,1,1,1,0,0,0,0,0,0,0,0,0,0,0,0,0,0,0,0,false,false,false,false,false,false,false,false,4,4,4,4,4,4,4,4,"嗯，这次进货也要选择沉稳……经典的……","不，应该走在流行前线。<br>那么就要尽可能的……拿到飞·乌尔的新作……","","","","","",""
84,0,0,0,0,0,0,0,0,0,0,0,0,0,0,0,0,1,1,1,1,1,1,1,1,0,0,0,0,0,0,0,0,0,0,0,0,0,0,0,0,false,false,false,false,false,false,false,false,4,4,4,4,4,4,4,4,"物资和市民都没能守住……<br>一切都被卢恩人夺走了。","虽然我们知道那些家伙的据点。<br>但连他们的进攻都抵挡不住的我们，根本没有胜算。","","","","","",""
85,1,1,1,1,1,1,1,1,0,0,0,0,0,0,0,0,1,1,1,1,1,1,1,1,0,0,0,0,0,0,0,0,0,0,0,0,0,0,0,0,false,false,false,false,false,false,false,false,4,4,4,4,4,4,4,4,"队长大人真的好帅喵。<br>虽然现在也很帅……但平时会更帅的喵！","今天只不过是一时大意，<br>下次我们绝对绝对不会输的喵！","","","","","",""
86,0,0,0,0,0,0,0,0,0,0,0,0,0,0,0,0,1,1,1,1,1,1,1,1,0,0,0,0,0,0,0,0,0,0,0,0,0,0,0,0,false,false,false,false,false,false,false,false,4,4,4,4,4,4,4,4,"市民和物资都被掳走了。<br>我这个队长实在是失职……","可是，为了那些努力着的部下，<br>我也要回归华丽的战线！<br>将笑容和荣耀献给我的部队！","","","","","",""
87,0,0,0,0,0,0,0,0,0,0,0,0,0,0,0,0,1,1,1,1,1,1,1,1,0,0,0,0,0,0,0,0,0,0,0,0,0,0,0,0,false,false,false,false,false,false,false,false,4,4,4,4,4,4,4,4,"虽然队长大人很爱自己，<br>不过也很爱大家喵。","希望队长大人可以赶快恢复到平时的状态，<br>散发神秘的闪亮亮气质喵……","","","","","",""
88,2,2,2,2,2,2,2,2,0,0,0,0,0,0,0,0,1,1,1,1,1,1,1,1,0,0,0,0,0,0,0,0,0,0,0,0,0,0,0,0,false,false,false,false,false,false,false,false,0,0,0,6,0,0,0,0,"啊，伤脑筋……<br>因为北边的十二神大圣堂要举办一场喜事，<br>所以我被委托运送蜂蜜酒……","但最近被香甜气味所吸引的巨蝇频繁出现，<br>很多人都受到了它们的袭击。","你是冒险者吧？<br>如果你方便的话，能护送我到大圣堂吗？","要帮忙吗？<br><br><color #FF7B1A>※此危命任务的推荐等级为<value>级。</color>","","","这样啊……<br>看来只能我自己去了……",""
89,1,1,1,1,1,1,1,1,0,0,0,0,0,0,0,0,1,1,1,1,1,1,1,1,0,0,0,0,0,0,0,0,0,0,0,0,0,0,0,0,false,false,false,false,false,false,false,false,4,4,4,4,4,4,4,4,"无法割舍海盗生活的家伙们都离开了……<br>留在这里的，都是决心要在这里重新开始的人。","","","","","","",""
90,1,1,1,1,1,1,1,1,0,0,0,0,0,0,0,0,1,1,1,1,1,1,1,1,0,0,0,0,0,0,0,0,0,0,0,0,0,0,0,0,false,false,false,false,false,false,false,false,4,4,4,4,4,4,4,4,"说实话，山上的生活很艰苦。<br>但比起继续当海盗，被四处通缉要好得多。","","","","","","",""
91,1,1,1,1,1,1,1,1,0,0,0,0,0,0,0,0,1,1,1,1,1,1,1,1,0,0,0,0,0,0,0,0,0,0,0,0,0,0,0,0,false,false,false,false,false,false,false,false,4,4,4,4,4,4,4,4,"没钱没材料……<br>要不要抢夺卢恩族的商店啊……","哎呀，不行。老毛病又犯了。","","","","","",""
92,1,1,1,1,1,1,1,1,0,0,0,0,0,0,0,0,1,1,1,1,1,1,1,1,0,0,0,0,0,0,0,0,0,0,0,0,0,0,0,0,false,false,false,false,false,false,false,false,4,4,4,4,4,4,4,4,"嗯，得先把这破破烂烂的建筑物改造一下。","","","","","","",""
93,1,1,1,1,1,1,1,1,0,0,0,0,0,0,0,0,1,1,1,1,1,1,1,1,0,0,0,0,0,0,0,0,0,0,0,0,0,0,0,0,false,false,false,false,false,false,false,false,4,4,4,4,4,4,4,4,"没完没了的！<br>到底从哪里着手开始做才好啊？！","","","","","","",""
94,1,1,1,1,1,1,1,1,0,0,0,0,0,0,0,0,1,1,1,1,1,1,1,1,0,0,0,0,0,0,0,0,0,0,0,0,0,0,0,0,false,false,false,false,false,false,false,false,4,4,4,4,4,4,4,4,"我们猎犬同盟海盗团因为5年前的灵灾而四分五裂……<br>我们集中剩下的人，一起移居至此。","","","","","","",""
95,1,1,1,1,1,1,1,1,0,0,0,0,0,0,0,0,1,1,1,1,1,1,1,1,0,0,0,0,0,0,0,0,0,0,0,0,0,0,0,0,false,false,false,false,false,false,false,false,4,4,4,4,4,4,4,4,"你看到村子角落里的那个拉拉菲尔族了吗？","别看她小小的，其实是个很有实力的海盗。<br>在海上的时候，论肉搏战可是无人能敌啊。<br>不过现在是以魔物和蛮族为对手施展拳脚。","","","","","",""
96,1,1,1,1,1,1,1,1,0,0,0,0,0,0,0,0,1,1,1,1,1,1,1,1,0,0,0,0,0,0,0,0,0,0,0,0,0,0,0,0,false,false,false,false,false,false,false,false,4,4,4,4,4,4,4,4,"你知道这个村子为什么要以“贫女材场”……<br>这种不吉利的名字来命名吗？","因为这里受到魔物和蛮族的侵害，<br>在这里工作的伐木工人总是失踪。<br>剩下的只有贫穷的未亡人。","","","","","",""
97,1,1,1,1,1,1,1,1,0,0,0,0,0,0,0,0,1,1,1,1,1,1,1,1,0,0,0,0,0,0,0,0,0,0,0,0,0,0,0,0,false,false,false,false,false,false,false,false,4,4,4,4,4,4,4,4,"这里原本是伐木工人的村落。<br>在第七灵灾的时候，住在这里的人都纷纷逃命去了。<br>我们是从提督那里得到的这座废弃的村落。","","","","","","",""
98,1,1,1,1,1,1,1,1,0,0,0,0,0,0,0,0,1,1,1,1,1,1,1,1,0,0,0,0,0,0,0,0,0,0,0,0,0,0,0,0,false,false,false,false,false,false,false,false,4,4,4,4,4,4,4,4,"虽然也有人怀念以前的海盗生活，<br>不过那时谁都是有苦衷的。<br>也有很多人是因为被诱拐才做了海盗的。","","","","","","",""
99,1,1,1,1,1,1,1,1,0,0,0,0,0,0,0,0,1,1,1,1,1,1,1,1,0,0,0,0,0,0,0,0,0,0,0,0,0,0,0,0,false,false,false,false,false,false,false,false,4,4,4,4,4,4,4,4,"现在想想，<br>那段不堪回首的海盗生活也挺让人怀念的……<br>是不是因为我老了啊？","","","","","","",""
100,1,1,1,1,1,1,1,1,0,0,0,0,0,0,0,0,1,1,1,1,1,1,1,1,0,0,0,0,0,0,0,0,0,0,0,0,0,0,0,0,false,false,false,false,false,false,false,false,4,4,4,4,4,4,4,4,"我们因为灵灾而失去了船，最终流浪至此。<br>因为这里只有我们在，所以尽管是在陆地上，<br>但依然和在船上时一样，自由自在。","","","","","","",""
101,1,1,1,1,1,1,1,1,0,0,0,0,0,0,0,0,1,1,1,1,1,1,1,1,0,0,0,0,0,0,0,0,0,0,0,0,0,0,0,0,false,false,false,false,false,false,false,false,4,4,4,4,4,4,4,4,"虽然魔物和蛮族会频繁袭击过来，<br>但这是我们好不容易得到的住处，<br>不会那么轻易放手的。","","","","","","",""
102,1,1,1,1,1,1,1,1,0,0,0,0,0,0,0,0,1,1,1,1,1,1,1,1,0,0,0,0,0,0,0,0,0,0,0,0,0,0,0,0,false,false,false,false,false,false,false,false,4,4,4,4,4,4,4,4,"5年前我是一个海盗小混混，<br>现在我是一个伐木工人小混混。<br>感觉变了，又好像没变。","","","","","","",""
103,1,1,1,1,1,1,1,1,0,0,0,0,0,0,0,0,1,1,1,1,1,1,1,1,0,0,0,0,0,0,0,0,0,0,0,0,0,0,0,0,false,false,false,false,false,false,false,false,4,4,4,4,4,4,4,4,"这里是贫女材场，是我们“猎犬同盟”的领地。<br>你没事就赶快离开。","","","","","","",""
104,1,1,1,1,1,1,1,1,0,0,0,0,0,0,0,0,1,1,1,1,1,1,1,1,0,0,0,0,0,0,0,0,0,0,0,0,0,0,0,0,false,false,false,false,false,false,false,false,4,4,4,4,4,4,4,4,"……嗯哼哼。<br>魔物和蛮族还不攻过来……","我早就厌倦做农活了。<br>啊，真想大干一场……","","","","","",""
105,1,1,1,1,1,1,1,1,0,0,0,0,0,0,0,0,1,1,1,1,1,1,1,1,0,0,0,0,0,0,0,0,0,0,0,0,0,0,0,0,false,false,false,false,false,false,false,false,4,4,4,4,4,4,4,4,"盛夏的舞女……<br>她们的舞姿如同被清风卷起的芳香花瓣一般，<br>让我的周围洋溢起欢喜的漩涡……","","","","","","",""
106,1,1,1,1,1,1,1,1,0,0,0,0,0,0,0,0,1,1,1,1,1,1,1,1,0,0,0,0,0,0,0,0,0,0,0,0,0,0,0,0,false,false,false,false,false,false,false,false,4,4,4,4,4,4,4,4,"这个世界上只有一个人可以为我带来春天，<br>而我愿将我的一切都献给那个人！！","","","","","","",""
107,2,2,2,2,2,2,2,2,0,0,0,0,0,0,0,0,1,1,1,1,1,1,1,1,0,0,0,0,0,0,0,0,0,0,0,0,0,0,0,0,false,false,false,false,false,false,false,false,0,0,0,0,0,0,0,0,"目前我们正在针对哥布林族<br>进行“海盗的掠夺品”的回收作战。<br>因为具有一定的危险性，所以请远离作战地点！","如果你想要参与协助的话，<br>那么请你将海盗的掠夺品拿来交给我。","掠夺品可以在营地内找到，<br>或者打倒哥布林族后就可以得到！","","","","",""
108,2,2,2,2,2,2,2,2,0,0,0,0,0,0,0,0,1,1,1,1,1,1,1,1,0,0,0,0,0,0,0,0,0,0,0,0,0,0,0,0,false,false,false,false,false,false,false,false,0,0,0,6,0,0,0,0,"嘘！<br>安静，我现在正在进行秘密行动。<br>不能让哥布林族发现。","其实是这样的，我得到情报说，<br>哥布林族在前面的营地内贩卖海盗的掠夺品……","因此正在准备回收海盗掠夺品的作战。","要提出帮忙吗？<br><br><color #FF7B1A>※此危命任务的推荐等级为<value>级。</color>","哦，那样就太好了！<br>掠夺品可以在营地内找到，<br>或者打倒哥布林族后就可以得到！","","嗯，那为了避免被卷入作战，<br>你还是离这里远一些吧。",""
109,2,2,2,2,2,2,2,2,0,0,0,0,0,0,0,0,1,1,1,1,1,1,1,1,0,0,0,0,0,0,0,0,0,0,0,0,0,0,0,0,false,false,false,false,false,false,false,false,0,5,0,0,0,0,0,0,"你带回海盗的掠夺品了吗？","","","","哦，太感谢了！<br>如果你再拿到其他的，还请接着带过来！","","你还没有回收到海盗的掠夺品吗？<br>你可以从营地内捡到，<br>或者从哥布林族身上抢到！",""
110,2,2,2,2,2,2,2,2,0,0,0,0,0,0,0,0,1,1,1,1,1,1,1,1,0,0,0,0,0,0,0,0,0,0,0,0,0,0,0,0,false,false,false,false,false,false,false,false,0,0,0,6,0,0,0,0,"打扰问你一下，<br>你是要去南防波堤的吗？","目前有一批物资必须要即刻送往南防波堤，<br>但因为发现了可疑船只，兵力都被派了出去，<br>现在没有人来护送我运输物资。","你可以和我同行，护送我到南防波堤吗？<br>因为最近这附近的街道很不太平。","要同行吗？<br><br><color #FF7B1A>※此危命任务的推荐等级为<value>级。</color>","","","那么我再找别人吧。",""
111,2,2,2,2,2,2,2,2,0,0,0,0,0,0,0,0,1,1,1,1,1,1,1,1,0,0,0,0,0,0,0,0,0,0,0,0,0,0,0,0,false,false,false,false,false,false,false,false,0,0,0,6,0,0,0,0,"干、干嘛啊……别想借着帮我，<br>就从我这里硬要走谢礼啊。","我就是到不远处的黄昏湾进货。<br>你看，小事一桩吧？","虽然那条路不怎么安全，<br>我又不小心膝盖受了伤，不过走路时小点声应该没事……<br>毕竟没钱雇佣护卫……","要送他去黄昏湾吗？<br><br><color #FF7B1A>※此危命任务的推荐等级为<value>级。</color>","","","你想嘲笑我的话去别处嘲笑。<br>祝你有一帮敌人追！",""
112,2,2,2,2,2,2,2,2,0,0,0,0,0,0,0,0,1,1,1,1,1,1,1,1,0,0,0,0,0,0,0,0,0,0,0,0,0,0,0,0,false,false,false,false,false,false,false,false,0,0,0,0,0,0,0,0,"土元精核心已经收集够了……<br>不过，如果你还有的话……给我。","","","","","","",""
113,2,2,2,2,2,2,2,2,0,0,0,0,0,0,0,0,1,1,1,1,1,1,1,1,0,0,0,0,0,0,0,0,0,0,0,0,0,0,0,0,false,false,false,false,false,false,false,false,0,5,0,0,0,0,0,0,"土元精核心已经收集够了……<br>当然，还是越多越好……","","","","那我就不客气了……<br>这些可以用在下一次的工作中……","","没关系……<br>反正我已经够数了。",""
114,2,2,2,2,2,2,2,2,0,0,0,0,0,0,0,0,1,1,1,1,1,1,1,1,0,0,0,0,0,0,0,0,0,0,0,0,0,0,0,0,false,false,false,false,false,false,false,false,0,0,0,0,0,0,0,0,"收集了好多仙人掌的肉质茎啊！<br>我不会忘记你的大恩大德的。","","","","","","",""
115,2,2,2,2,2,2,2,2,0,0,0,0,0,0,0,0,1,1,1,1,1,1,1,1,0,0,0,0,0,0,0,0,0,0,0,0,0,0,0,0,false,false,false,false,false,false,false,false,0,5,0,0,0,0,0,0,"仙人掌的肉质茎？<br>这些也是给我的吗？","","","","哇啊，谢谢你！<br>有这么多的话我也可以吃一些了！","","冒险者也喜欢仙人掌啊。",""
116,2,2,2,2,2,2,2,2,0,0,0,0,0,0,0,0,1,1,1,1,1,1,1,1,0,0,0,0,0,0,0,0,0,0,0,0,0,0,0,0,false,false,false,false,false,false,false,false,0,0,0,0,0,0,0,0,"被盗贼团体抢走的货物全部都夺回来了。<br>都是多亏了冒险者大人啊！","","","","","","",""
117,2,2,2,2,2,2,2,2,0,0,0,0,0,0,0,0,1,1,1,1,1,1,1,1,0,0,0,0,0,0,0,0,0,0,0,0,0,0,0,0,false,false,false,false,false,false,false,false,0,5,0,0,0,0,0,0,"哎？还有我的货物吗？","","","","哈哈，原来还有这件啊。<br>真不愧是冒险者大人，滴水不漏！","","也是啊！我的货物已经全部都在这里了！",""
118,2,2,2,2,2,2,2,2,0,0,0,0,0,0,0,0,1,1,1,1,1,1,1,1,0,0,0,0,0,0,0,0,0,0,0,0,0,0,0,0,false,false,false,false,false,false,false,false,0,0,0,0,0,0,0,0,"已经有这么多魂石了……<br>嗯，看来能进行细致的研究了。","","","","","","",""
119,2,2,2,2,2,2,2,2,0,0,0,0,0,0,0,0,1,1,1,1,1,1,1,1,0,0,0,0,0,0,0,0,0,0,0,0,0,0,0,0,false,false,false,false,false,false,false,false,0,5,0,0,0,0,0,0,"你还有巨像兵的魂石吗？<br>好啊，那就交给我吧。","","","","虽然已经够了，不过还是会忍不住想要呢。<br>因为你太有奉献精神了。","","哎呀，你是在耍我吗？",""
120,2,2,2,2,2,2,2,2,0,0,0,0,0,0,0,0,1,1,1,1,1,1,1,1,0,0,0,0,0,0,0,0,0,0,0,0,0,0,0,0,false,false,false,false,false,false,false,false,0,0,0,6,0,0,0,0,"啊，那边的冒险者！<br>你能听听我的请求吗？","我在收集“虹蝶贝”来制作手工艺品。<br>但是……突然有好多蜂鸟出现，<br>把贝壳都吃掉了……","不过，它们要消化贝壳还需要一段时间！<br>所以拜托你从蜂鸟身上取回虹蝶贝！<br>不管用什么手段都可以……","要取回虹蝶贝吗？<br><br><color #FF7B1A>※此危命任务的推荐等级为<value>级。</color>","太好了！<br>谢谢你，冒险者！","","怎么这样……<br>啊，要不快点的话贝壳就要被消化了……",""
121,2,2,2,2,2,2,2,2,0,0,0,0,0,0,0,0,1,1,1,1,1,1,1,1,0,0,0,0,0,0,0,0,0,0,0,0,0,0,0,0,false,false,false,false,false,false,false,false,0,0,0,0,0,0,0,0,"请你在蜂鸟将虹蝶贝消化完之前把它们夺回来！","","","","","","",""
122,2,2,2,2,2,2,2,2,0,0,0,0,0,0,0,0,1,1,1,1,1,1,1,1,0,0,0,0,0,0,0,0,0,0,0,0,0,0,0,0,false,false,false,false,false,false,false,false,0,5,0,0,0,0,0,0,"你带回虹蝶贝了吗？","","","","谢谢你！<br>应该还有些吞了贝壳的蜂鸟。<br>请你再多取回来一些！","","请快一些，在蜂鸟将贝壳消化前……",""
123,2,2,2,2,2,2,2,2,0,0,0,0,0,0,0,0,1,1,1,1,1,1,1,1,0,0,0,0,0,0,0,0,0,0,0,0,0,0,0,0,false,false,false,false,false,false,false,false,0,0,0,0,0,0,0,0,"虹蝶贝已经收集得差不多了。<br>虽然有些黏呼呼的……<br>不过还是可以加工成优良的手工艺品。","","","","","","",""
